{"entry_count":58,"inventory_path":"manifests/content-manifest-inventory.jsonl","inventory_sha256":"sha256:61e084fb599ac50fee7d7798de7f87ec7b65107760e3b5f40742c4d69bc85820","inventory_size_bytes":12396,"profile":"student","schema_version":"tome_content_manifest_header_v3","semantic_identity_digest":"sha256:bd24bb5210c02b0453fc918415e937fa81789f12851f41cf91cac1846f98fcaa"}