{"entry_count":58,"inventory_path":"manifests/content-manifest-inventory.jsonl","inventory_sha256":"sha256:e5580b3081bd81c466c528de405b090ca4cb6bde1bba623c9e7c892b6ff40f50","inventory_size_bytes":12398,"profile":"student","schema_version":"tome_content_manifest_header_v3","semantic_identity_digest":"sha256:18475d1a02a202551462176095857b640921238d717a6fb0a8b374091f7f17a7"}